Title,Year,Authors,GatesAuthors
"""Everybody knows what you're doing"" - a critical design approach to personal informatics.",2013,"Vera D. Khovanskaya, Eric P. S. Baumer, Dan Cosley, Stephen Voida, Geri Gay, ","Dan Cosley, Geri Gay"
"""I lie to myself that i have freedom in my own schedule"" - productivity tools and experiences of busyness.",2011,"Gilly Leshed, Phoebe Sengers, ","Gilly Leshed, Phoebe Sengers"
A brief overview of the NEBULA future internet architecture.,2014,"Tom Anderson, Ken Birman, Robert M. Broberg, Matthew Caesar, Douglas Comer, Chase Cotton, Michael J. Freedman, Andreas Haeberlen, Zachary G. Ives, Arvind Krishnamurthy, William Lehr, Boon Thau Loo, David Mazi赤res, Antonio Nicolosi, Jonathan M. Smith, Ion Stoica, Robbert van Renesse, Michael Walfish, Hakim Weatherspoon, Christopher S. Yoo, ","Hakim Weatherspoon, Ken Birman, Robbert van Renesse"
A Coalgebraic Decision Procedure for NetKAT.,2015,"Nate Foster, Dexter Kozen, Matthew Milano, Alexandra Silva 0001, Laure Thompson, ","Dexter Kozen, Nate Foster"
A Collaborative Infrastructure for Scalable and Robust News Delivery.,2002,"Werner Vogels, Christopher R姓, Robbert van Renesse, Kenneth P. Birman, ","Ken Birman, Robbert van Renesse"
A diversified and correct-by-construction broadcast service.,2012,"Vincent Rahli, Nicolas Schiper, Robbert van Renesse, Mark Bickford, Robert L. Constable, ","Robbert van Renesse, Robert Constable"
A fast distributed slicing algorithm.,2008,"Vincent Gramoli, Ymir Vigfusson, Ken Birman, Anne-Marie Kermarrec, Robbert van Renesse, ","Ken Birman, Robbert van Renesse"
A Framework for Protocol Composition in Horus.,1995,"Robbert van Renesse, Kenneth P. Birman, Roy Friedman, Mark Hayden, David A. Karr, ","Ken Birman, Robbert van Renesse"
A Graph-Based Approach Towards Discerning Inherent Structures in a Digital Library of Formal Mathematics.,2004,"Lori Lorigo, Jon M. Kleinberg, Richard Eaton, Robert L. Constable, ","Jon Kleinberg, Robert Constable"
A Measure of Polarization on Social Media Networks Based on Community Boundaries.,2013,"Pedro Henrique Calais Guerra, Wagner Meira Jr., Claire Cardie, Robert Kleinberg, ","Claire Cardie, Robert Kleinberg"
A New Start - Innovative Introductory AI-Centered Courses at Cornell.,2008,"Eric Breck, David A. Easley, K.-Y. Daisy Fan, Jon M. Kleinberg, Lillian Lee, Jennifer Wofford, Ramin Zabih, ","David Easley, Jon Kleinberg, Lillian Lee"
A Probabilistically Correct Leader Election Protocol for Large Groups.,2000,"Indranil Gupta, Robbert van Renesse, Kenneth P. Birman, ","Ken Birman, Robbert van Renesse"
A radiative transfer framework for rendering materials with anisotropic structure.,2010,"Wenzel Jakob, Adam Arbree, Jonathan T. Moon, Kavita Bala, Steve Marschner, ","Kavita Bala, Steve Marschner"
A Scalable Services Architecture.,2006,"Tudor Marian, Ken Birman, Robbert van Renesse, ","Ken Birman, Robbert van Renesse"
A Security Architecture for Fault-Toerant Systems.,1994,"Michael K. Reiter, Kenneth P. Birman, Robbert van Renesse, ","Ken Birman, Robbert van Renesse"
A separability framework for analyzing community structure.,2014,"Bruno D. Abrahao, Sucheta Soundarajan, John E. Hopcroft, Robert D. Kleinberg, ","John Hopcroft, Robert Kleinberg"
A stateless approach to connection-oriented protocols.,2008,"Alan Shieh, Andrew C. Myers, Emin G神n Sirer, ","Andrew Myers, Emin Gun Sirer"
A TACOMA retrospective.,2002,"Dag Johansen, K衰re J. Lauvset, Robbert van Renesse, Fred B. Schneider, Nils P. Sudmann, Kjetil Jacobsen, ","Fred Schneider, Robbert van Renesse"
"A tag in the hand - supporting semantic, social, and spatial navigation in museums.",2009,"Dan Cosley, Jonathan Baxter, Soyoung Lee, Brian Alson, Saeko Nomura, Phil Adams, Chethan Sarabu, Geri Gay, ","Dan Cosley, Geri Gay"
A Transparent Light-Weight Group Service.,1996,"Lu神s E. T. Rodrigues, Katherine Guo, Antonio Sargento, Robbert van Renesse, Bradford B. Glade, Paulo Ver神ssimo, Kenneth P. Birman, ","Ken Birman, Robbert van Renesse"
Accurately interpreting clickthrough data as implicit feedback.,2005,"Thorsten Joachims, Laura A. Granka, Bing Pan, Helene Hembrooke, Geri Gay, ","Geri Gay, Thorsten Joachims "
Active and passive techniques for group size estimation in large-scale and dynamic distributed systems.,2007,"Dionysios Kostoulas, Dimitrios Psaltoulis, Indranil Gupta, Kenneth P. Birman, Alan J. Demers, ","Alan Demers, Ken Birman"
Adding High Availability and Autonomic Behavior to Web Services.,2004,"Kenneth P. Birman, Robbert van Renesse, Werner Vogels, ","Ken Birman, Robbert van Renesse"
Adversarial Deep Averaging Networks for Cross-Lingual Sentiment Classification.,2016,"Xilun Chen, Ben Athiwaratkun, Yu Sun, Kilian Q. Weinberger, Claire Cardie, ","Claire Cardie, Kilian Weinberger"
Affective presence in museums - Ambient systems for creative expression.,2005,"Kirsten Boehner, Phoebe Sengers, Geri Gay, ","Geri Gay, Phoebe Sengers"
An analysis of Facebook photo caching.,2013,"Qi Huang, Ken Birman, Robbert van Renesse, Wyatt Lloyd, Sanjeev Kumar, Harry C. Li, ","Ken Birman, Robbert van Renesse"
An Evaluation of Checkpoint Recovery for Massively Multiplayer Online Games.,2009,"Marcos Antonio Vaz Salles, Tuan Cao, Benjamin Sowell, Alan J. Demers, Johannes Gehrke, Christoph Koch 0001, Walker M. White, ","Alan Demers, Walker White"
Application-driven TCP recovery and non-stop BGP.,2013,"Robert Surton, Ken Birman, Robbert van Renesse, ","Ken Birman, Robbert van Renesse"
APSS - proactive secret sharing in asynchronous systems.,2005,"Lidong Zhou, Fred B. Schneider, Robbert van Renesse, ","Fred Schneider, Robbert van Renesse"
ArtLinks - fostering social awareness and reflection in museums.,2008,"Dan Cosley, Joel Lewenstein, Andrew Herman, Jenna Holloway, Jonathan Baxter, Saeko Nomura, Kirsten Boehner, Geri Gay, ","Dan Cosley, Geri Gay"
"Astrolabe - A robust and scalable technology for distributed system monitoring, management, and data mining.",2003,"Robbert van Renesse, Kenneth P. Birman, Werner Vogels, ","Ken Birman, Robbert van Renesse"
Automatic detection of social rhythms in bipolar disorder.,2016,"Saeed Abdullah, Mark Matthews, Ellen Frank, Gavin Doherty, Geri Gay, Tanzeem Choudhury, ","Geri Gay, Tanzeem Choudhury"
Behavioral Mechanism Design - Optimal Contests for Simple Agents.,2014,"Arpita Ghosh, Robert Kleinberg, ","Arpita Ghosh, Robert Kleinberg"
Behavioral Mechanism Design - Optimal Crowdsourcing Contracts and Prospect Theory.,2015,"David Easley, Arpita Ghosh, ","Arpita Ghosh, David Easley"
Behavioral Simulations in MapReduce.,2010,"Guozhang Wang, Marcos Antonio Vaz Salles, Benjamin Sowell, Xun Wang, Tuan Cao, Alan J. Demers, Johannes Gehrke, Walker M. White, ","Alan Demers, Walker White"
Belief in Information Flow.,2005,"Michael R. Clarkson, Andrew C. Myers, Fred B. Schneider, ","Andrew Myers, Fred Schneider, Michael Clarkson"
"Better scripts, better games.",2009,"Walker M. White, Christoph Koch 0001, Johannes Gehrke, Alan J. Demers, ","Alan Demers, Walker White"
"Better Scripts, Better Games.",2008,"Walker M. White, Christoph Koch 0001, Johannes Gehrke, Alan J. Demers, ","Alan Demers, Walker White"
Beyond Power Proportionality - Designing Power-Lean Cloud Storage.,2011,"Lakshmi Ganesh, Hakim Weatherspoon, Ken Birman, ","Hakim Weatherspoon, Ken Birman"
Biological rhythms and technology.,2014,"Mark Matthews, Erin H. C. Carroll, Saeed Abdullah, Jaime Snyder, Matthew Kay, Tanzeem Choudhury, Geri Gay, Julie A. Kientz, ","Geri Gay, Tanzeem Choudhury"
Bitcoin-NG - A Scalable Blockchain Protocol.,2015,"Ittay Eyal, Adem Efe Gencer, Emin G神n Sirer, Robbert van Renesse, ","Emin Gun Sirer, Robbert van Renesse"
Building a Secure and Privacy-Preserving Smart Grid.,2015,"Ken Birman, M錐rk Jelasity, Robert Kleinberg, Edward Tremel, ","Ken Birman, Robert Kleinberg"
Building Adaptive Systems Using Ensemble.,1998,"Robbert van Renesse, Kenneth P. Birman, Mark Hayden, Alexey Vaysburd, David A. Karr, ","Ken Birman, Robbert van Renesse"
"Building reliable, high-performance communication systems from components.",1999,"Xiaoming Liu 0003, Christoph Kreitz, Robbert van Renesse, Jason Hickey, Mark Hayden, Kenneth P. Birman, Robert L. Constable, ","Ken Birman, Robbert van Renesse, Robert Constable"
Building volumetric appearance models of fabric using micro CT imaging.,2011,"Shuang Zhao, Wenzel Jakob, Steve Marschner, Kavita Bala, ","Kavita Bala, Steve Marschner"
Cache Serializability - Reducing Inconsistency in Edge Transactions.,2015,"Ittay Eyal, Ken Birman, Robbert van Renesse, ","Ken Birman, Robbert van Renesse"
Cantor meets Scott - Domain-Theoretic Foundations for Probabilistic Network Programming.,2016,"Steffen Smolka, Praveen Kumar, Nate Foster, Dexter Kozen, Alexandra Silva 0001, ","Dexter Kozen, Nate Foster"
Cantor meets scott - semantic foundations for probabilistic networks.,2017,"Steffen Smolka, Praveen Kumar, Nate Foster, Dexter Kozen, Alexandra Silva 0001, ","Dexter Kozen, Nate Foster"
Cats and Captions vs. Creators and the Clock - Comparing Multimodal Content to Context in Predicting Relative Popularity.,2017,"Jack Hessel, Lillian Lee, David M. Mimno, ","David Mimno, Lillian Lee"
Cayuga - A General Purpose Event Monitoring System.,2007,"Alan J. Demers, Johannes Gehrke, Biswanath Panda, Mirek Riedewald, Varun Sharma, Walker M. White, ","Alan Demers, Walker White"
Cayuga - a high-performance event processing engine.,2007,"Lars Brenna, Alan J. Demers, Johannes Gehrke, Mingsheng Hong, Joel Ossher, Biswanath Panda, Mirek Riedewald, Mohit Thatte, Walker M. White, ","Alan Demers, Walker White"
Certified In-lined Reference Monitoring on .NET.,2006,"Kevin W. Hamlen, Greg Morrisett, Fred B. Schneider, ","Fred Schneider, Greg Morrisett"
Chain Replication for Supporting High Throughput and Availability.,2004,"Robbert van Renesse, Fred B. Schneider, ","Fred Schneider, Robbert van Renesse"
Chameleons in imagined conversations - A new approach to understanding coordination of linguistic style in dialogs,2011,"Cristian Danescu-Niculescu-Mizil, Lillian Lee, ","Cristian Danescu-Niculescu-Mizil, Lillian Lee"
"Characterizing and curating conversation threads - Expansion, focus, volume, re-entry",2013,"Lars Backstrom, Jon M. Kleinberg, Lillian Lee, Cristian Danescu-Niculescu-Mizil, ","Cristian Danescu-Niculescu-Mizil, Jon Kleinberg, Lillian Lee"
Characterizing Load Imbalance in Real-World Networked Caches.,2014,"Qi Huang, Helga Gudmundsdottir, Ymir Vigfusson, Daniel A. Freedman, Ken Birman, Robbert van Renesse, ","Ken Birman, Robbert van Renesse"
Civitas - A Secure Remote Voting System.,2007,"Michael E. Clarkson, Stephen Chong, Andrew C. Myers, ","Andrew Myers, Michael Clarkson"
Civitas - Toward a Secure Voting System.,2008,"Michael R. Clarkson, Stephen Chong, Andrew C. Myers, ","Andrew Myers, Michael Clarkson"
COCA - A secure distributed online certification authority.,2002,"Lidong Zhou, Fred B. Schneider, Robbert van Renesse, ","Fred Schneider, Robbert van Renesse"
Cognitive Adaptive Radio Teams.,2006,"Richard Lau, Stephanie Demers, Yibei Ling, Bruce Siegell, Einar Vollset, Ken Birman, Robbert van Renesse, Howard E. Shrobe, Jonathan Bachrach, Lester Foster, ","Ken Birman, Robbert van Renesse"
Cognitive rhythms - unobtrusive and continuous sensing of alertness using a mobile phone.,2016,"Saeed Abdullah, Elizabeth L. Murnane, Mark Matthews, Matthew Kay, Julie A. Kientz, Geri Gay, Tanzeem Choudhury, ","Geri Gay, Tanzeem Choudhury"
Competition and Selection Among Conventions.,2017,"Rahmtin Rotabi, Cristian Danescu-Niculescu-Mizil, Jon M. Kleinberg, ","Cristian Danescu-Niculescu-Mizil, Jon Kleinberg"
Configuring Distributed Computations Using Response Surfaces.,2015,"Adem Efe Gencer, David Bindel, Emin G神n Sirer, Robbert van Renesse, ","David Bindel, Emin Gun Sirer, Robbert van Renesse"
Constructive Decision Theory,2009,"Lawrence E. Blume, David A. Easley, Joseph Y. Halpern, ","David Easley, Joseph Halpern"
Constructive Decision Theory.,2013,"Lawrence E. Blume, David A. Easley, Joseph Y. Halpern, ","David Easley, Joseph Halpern"
Controlled Transactional Consistency for Web Caching.,2014,"Ittay Eyal, Ken Birman, Robbert van Renesse, ","Ken Birman, Robbert van Renesse"
Correctness of a gossip based membership protocol.,2005,"Andr姓 Allavena, Alan J. Demers, John E. Hopcroft, ","Alan Demers, John Hopcroft"
Crowdsourcing Law and Policy - A Design-Thinking Approach to Crowd-Civic Systems.,2017,"Brian James McInnis, Alissa Centivany, Juho Kim, Marta Poblet, Karen Levy, Gilly Leshed, ","Gilly Leshed, Karen Levy"
Cryptographic support for fault-tolerant distributed computing.,1996,"Yaron Minsky, Robbert van Renesse, Fred B. Schneider, Scott D. Stoller, ","Fred Schneider, Robbert van Renesse"
"Crystallize - An Immersive, Collaborative Game for Second Language Learning.",2016,"Gabriel Culbertson, Erik L. Andersen, Walker M. White, Daniel Zhang, Malte F. Jung, ","Erik  Andersen, Malte Jung, Walker White"
Culturally Embedded Computing.,2004,"Phoebe Sengers, Joseph Kaye, Kirsten Boehner, Jeremiah Fairbank, Geri Gay, Yevgeniy Eugene Medynskiy, Susan Wyche, ","Geri Gay, Phoebe Sengers"
Cutting into collaboration - understanding coordination in distributed and interdisciplinary medical research.,2008,"Saeko Nomura, Jeremy P. Birnholtz, Oya Rieger, Gilly Leshed, Deborah Trumbull, Geri Gay, ","Geri Gay, Gilly Leshed"
Database research in computer games.,2009,"Alan J. Demers, Johannes Gehrke, Christoph Koch 0001, Ben Sowell, Walker M. White, ","Alan Demers, Walker White"
Database research opportunities in computer games.,2007,"Walker M. White, Christoph Koch 0001, Nitin Gupta 0003, Johannes Gehrke, Alan J. Demers, ","Alan Demers, Walker White"
Decentralized Schemes for Size Estimation in Large and Dynamic Groups.,2005,"Dionysios Kostoulas, Dimitrios Psaltoulis, Indranil Gupta, Ken Birman, Alan J. Demers, ","Alan Demers, Ken Birman"
Deep Feature Interpolation for Image Content Changes.,2016,"Paul Upchurch, Jacob R. Gardner, Kavita Bala, Robert Pless, Noah Snavely, Kilian Q. Weinberger, ","Kavita Bala, Kilian Weinberger"
Deep Manifold Traversal - Changing Labels with Convolutional Features.,2015,"Jacob R. Gardner, Matt J. Kusner, Yixuan Li, Paul Upchurch, Kilian Q. Weinberger, John E. Hopcroft, ","John Hopcroft, Kilian Weinberger"
Dense and Non-Dense Families of Complexity Classes,1969,"Allan Borodin, Robert L. Constable, John E. Hopcroft, ","John Hopcroft, Robert Constable"
Detecting and Capitalizing on Physiological Dimensions of Psychiatric Illness.,2016,"Mark Matthews, Saeed Abdullah, Geri Gay, Tanzeem Choudhury, ","Geri Gay, Tanzeem Choudhury"
Detecting Overlapping Communities from Local Spectral Subspaces.,2015,"Kun He, Yiwei Sun, David Bindel, John E. Hopcroft, Yixuan Li, ","David Bindel, John Hopcroft"
Developing Correctly Replicated Databases Using Formal Tools.,2014,"Nicolas Schiper, Vincent Rahli, Robbert van Renesse, Mark Bickford, Robert L. Constable, ","Robbert van Renesse, Robert Constable"
Device Driver Safety Through a Reference Validation Mechanism.,2008,"Dan Williams, Patrick Reynolds, Kevin Walsh, Emin G神n Sirer, Fred B. Schneider, ","Emin Gun Sirer, Fred Schneider"
Distributed Protocols and Heterogeneous Trust - Technical Report.,2014,"Isaac C. Sheff, Robbert van Renesse, Andrew C. Myers, ","Andrew Myers, Robbert van Renesse"
Does Bad News Go Away Faster?,2011,"Shaomei Wu, Chenhao Tan, Jon M. Kleinberg, Michael W. Macy, ","Jon Kleinberg, Michael Macy"
Don't 'Have a Clue'? Unsupervised Co-Learning of Downward-Entailing Operators.,2010,"Cristian Danescu-Niculescu-Mizil, Lillian Lee, ","Cristian Danescu-Niculescu-Mizil, Lillian Lee"
Echoes of power - Language effects and power differences in social interaction,2011,"Cristian Danescu-Niculescu-Mizil, Lillian Lee, Bo Pang, Jon M. Kleinberg, ","Cristian Danescu-Niculescu-Mizil, Jon Kleinberg, Lillian Lee"
Echoes of power - language effects and power differences in social interaction.,2012,"Cristian Danescu-Niculescu-Mizil, Lillian Lee, Bo Pang, Jon M. Kleinberg, ","Cristian Danescu-Niculescu-Mizil, Jon Kleinberg, Lillian Lee"
Economics of a supercloud.,2016,"Ian A. Kash, Qin Jia, Zhiming Shen, Weijia Song, Robbert van Renesse, Hakim Weatherspoon, ","Hakim Weatherspoon, Robbert van Renesse"
Edge-Weighted Personalized PageRank - Breaking A Decade-Old Performance Barrier.,2015,"Wenlei Xie, David Bindel, Alan J. Demers, Johannes Gehrke, ","Alan Demers, David Bindel"
Effects of implicit sharing in collaborative analysis.,2014,"Nitesh Goyal, Gilly Leshed, Dan Cosley, Susan R. Fussell, ","Dan Cosley, Gilly Leshed"
Efficient Buffering in Reliable Multicast Protocols.,1999,"神znur 神zkasap, Robbert van Renesse, Kenneth P. Birman, Zhen Xiao, ","Ken Birman, Robbert van Renesse"
EmotionCheck - leveraging bodily signals and false feedback to regulate our emotions.,2016,"Jean Marcel dos Reis Costa, Alexander Travis Adams, Malte F. Jung, Fran神ois Guimbeti赤re, Tanzeem Choudhury, ","Malte Jung, Tanzeem Choudhury"
Empirical characterization of uncongested optical lambda networks and 10GbE commodity endpoints.,2010,"Tudor Marian, Daniel A. Freedman, Ken Birman, Hakim Weatherspoon, ","Hakim Weatherspoon, Ken Birman"
Enforcing Privacy Policies with Meta-Code.,2015,"H衰vard D. Johansen, Eleanor Birrell, Robbert van Renesse, Fred B. Schneider, Magnus Stenhaug, Dag Johansen, ","Fred Schneider, Robbert van Renesse"
Error bounds for correlation clustering.,2005,"Thorsten Joachims, John E. Hopcroft, ","John Hopcroft, Thorsten Joachims "
Evaluating the accuracy of implicit feedback from clicks and query reformulations in Web search.,2007,"Thorsten Joachims, Laura A. Granka, Bing Pan, Helene Hembrooke, Filip Radlinski, Geri Gay, ","Geri Gay, Thorsten Joachims "
Evaluation methods for unsupervised word embeddings.,2015,"Tobias Schnabel, Igor Labutov, David M. Mimno, Thorsten Joachims, ","David Mimno, Thorsten Joachims"
Exact temporal characterization of 10 Gbps optical wide-area network.,2010,"Daniel A. Freedman, Tudor Marian, Jennifer H. Lee, Ken Birman, Hakim Weatherspoon, Chris Xu, ","Hakim Weatherspoon, Ken Birman"
Experience with 3 SDN Controllers in an Enterprise Setting.,2016,"Zhiyuan Teo, Ken Birman, Robbert van Renesse, ","Ken Birman, Robbert van Renesse"
Exploiting Gossip for Self-Management in Scalable Event Notification Systems.,2007,"Ken Birman, Anne-Marie Kermarrec, Krzysztof Ostrowski, Marin Bertier, Danny Dolev, Robbert van Renesse, ","Ken Birman, Robbert van Renesse"
Eye tracking and online search - Lessons learned and challenges ahead.,2008,"Lori Lorigo, Maya Haridasan, Hr神nn Brynjarsd神ttir, Ling Xia, Thorsten Joachims, Geri Gay, Laura A. Granka, Fabio Pellacini, Bing Pan, ","Geri Gay, Thorsten Joachims"
Eye-tracking analysis of user behavior in WWW search.,2004,"Laura A. Granka, Thorsten Joachims, Geri Gay, ","Geri Gay, Thorsten Joachims"
Fabric - a platform for secure distributed computation and storage.,2009,"Jed Liu, Michael D. George, K. Vikram, Xin Qi, Lucas Waye, Andrew C. Myers, ","Andrew Myers, Michael George"
Facilitating Development of Pragmatic Competence through a Voice-driven Video Learning Interface.,2017,"Gabriel Culbertson, Solace Shen, Malte F. Jung, Erik Andersen, ","Erik  Andersen, Malte Jung"
Fast checkpoint recovery algorithms for frequently consistent applications.,2011,"Tuan Cao, Marcos Antonio Vaz Salles, Benjamin Sowell, Yao Yue, Alan J. Demers, Johannes Gehrke, Walker M. White, ","Alan Demers, Walker White"
Fast Iterative Graph Computation with Block Updates.,2013,"Wenlei Xie, Guozhang Wang, David Bindel, Alan J. Demers, Johannes Gehrke, ","Alan Demers, David Bindel"
Feedback effects between similarity and social influence in online communities.,2008,"David J. Crandall, Dan Cosley, Daniel P. Huttenlocher, Jon M. Kleinberg, Siddharth Suri, ","Dan Cosley, Jon Kleinberg"
Feedback for guiding reflection on teamwork practices.,2007,"Gilly Leshed, Jeffrey T. Hancock, Dan Cosley, Poppy L. McLeod, Geri Gay, ","Dan Cosley, Geri Gay, Gilly Leshed"
Finding social roles in Wikipedia.,2011,"Howard T. Welser, Dan Cosley, Gueorgi Kossinets, Austin Lin, Fedor Dokshin, Geri Gay, Marc A. Smith, ","Dan Cosley, Geri Gay"
Follow the Sun through the Clouds - Application Migration for Geographically Shifting Workloads.,2016,"Zhiming Shen, Qin Jia, Gur-Eyal Sela, Ben Rainero, Weijia Song, Robbert van Renesse, Hakim Weatherspoon, ","Hakim Weatherspoon, Robbert van Renesse"
For the sake of simplicity - Unsupervised extraction of lexical simplifications from Wikipedia.,2010,"Mark Yatskar, Bo Pang, Cristian Danescu-Niculescu-Mizil, Lillian Lee, ","Cristian Danescu-Niculescu-Mizil, Lillian Lee"
From Declarative Languages to Declarative Processing in Computer Games,2009,"Benjamin Sowell, Alan J. Demers, Johannes Gehrke, Nitin Gupta 0003, Haoyuan Li, Walker M. White, ","Alan Demers, Walker White"
Have your Cake and Eat it Too - Foreign Language Learning with a Crowdsourced Video Captioning System.,2017,"Gabriel Culbertson, Solace Shen, Erik Andersen, Malte F. Jung, ","Erik  Andersen, Malte Jung"
Hedge detection as a lens on framing in the GMO debates - A position paper,2012,"Eunsol Choi, Chenhao Tan, Lillian Lee, Cristian Danescu-Niculescu-Mizil, Jennifer Spindel, ","Cristian Danescu-Niculescu-Mizil, Lillian Lee"
Horus - A Flexible Group Communication System.,1996,"Robbert van Renesse, Kenneth P. Birman, Silvano Maffeis, ","Ken Birman, Robbert van Renesse"
How bad is forming your own opinion?,2015,"David Bindel, Jon M. Kleinberg, Sigal Oren, ","David Bindel, Jon Kleinberg"
How Bad is Forming Your Own Opinion?,2011,"David Bindel, Jon M. Kleinberg, Sigal Oren, ","David Bindel, Jon Kleinberg"
How opinions are received by online communities - A case study on Amazon.com helpfulness votes,2009,"Cristian Danescu-Niculescu-Mizil, Gueorgi Kossinets, Jon M. Kleinberg, Lillian Lee, ","Cristian Danescu-Niculescu-Mizil, Jon Kleinberg, Lillian Lee"
Hyperproperties.,2008,"Michael R. Clarkson, Fred B. Schneider, ","Fred Schneider, Michael Clarkson"
"In Google We Trust - Users' Decisions on Rank, Position, and Relevance.",2007,"Bing Pan, Helene Hembrooke, Thorsten Joachims, Lori Lorigo, Geri Gay, Laura A. Granka, ","Geri Gay, Thorsten Joachims"
In Situ Design for Mental Illness - Considering the Pathology of Bipolar Disorder in mHealth Design.,2015,"Mark Matthews, Stephen Voida, Saeed Abdullah, Gavin Doherty, Tanzeem Choudhury, Sangha Im, Geri Gay, ","Geri Gay, Tanzeem Choudhury"
In-car gps navigation - engagement with and disengagement from the environment.,2008,"Gilly Leshed, Theresa Velden, Oya Rieger, Blazej J. Kot, Phoebe Sengers, ","Gilly Leshed, Phoebe Sengers"
"Incentives, Gamification, and Game Theory - An Economic Approach to Badge Design.",2016,"David Easley, Arpita Ghosh, ","Arpita Ghosh, David Easley"
"Incentives, gamification, and game theory - an economic approach to badge design.",2013,"David Easley, Arpita Ghosh, ","Arpita Ghosh, David Easley"
Incentivizing exploration.,2014,"Peter I. Frazier, David Kempe 0001, Jon M. Kleinberg, Robert Kleinberg, ","Jon Kleinberg, Robert Kleinberg"
Incentivizing participation in online forums for education.,2013,"Arpita Ghosh, Jon M. Kleinberg, ","Arpita Ghosh, Jon Kleinberg"
Inferential Privacy Guarantees for Differentially Private Mechanisms.,2016,"Arpita Ghosh, Robert Kleinberg, ","Arpita Ghosh, Robert Kleinberg"
Integrated Approach to Data Center Power Management.,2013,"Lakshmi Ganesh, Hakim Weatherspoon, Tudor Marian, Ken Birman, ","Hakim Weatherspoon, Ken Birman"
Internet Collaboration on Extremely Difficult Problems - Research versus Olympiad Questions on the Polymath Site.,2016,"Isabel Mette Kloumann, Chenhao Tan, Jon M. Kleinberg, Lillian Lee, ","Jon Kleinberg, Lillian Lee"
Introduction to computer science and economic theory.,2015,"Lawrence E. Blume, David A. Easley, Jon M. Kleinberg, Robert D. Kleinberg, 神va Tardos, ","David Easley, Jon Kleinberg, Robert Kleinberg"
"Ironstack - Performance, Stability and Security for Power Grid Data Networks.",2014,"Zhiyuan Teo, Vera Kutsenko, Ken Birman, Robbert van Renesse, ","Ken Birman, Robbert van Renesse"
Isomorphism and embedding problems for infinite limits of scale-free graphs.,2005,"Robert D. Kleinberg, Jon M. Kleinberg, ","Jon Kleinberg, Robert Kleinberg"
Kelips - Building an Efficient and Stable P2P DHT through Increased Memory and Background Overhead.,2003,"Indranil Gupta, Kenneth P. Birman, Prakash Linga, Alan J. Demers, Robbert van Renesse, ","Alan Demers, Ken Birman, Robbert van Renesse"
Knowledge-Based Synthesis of Distributed Systems Using Event Structures,2011,"Mark Bickford, Robert L. Constable, Joseph Y. Halpern, Sabina Petride, ","Joseph Halpern, Robert Constable"
Knowledge-Based Synthesis of Distributed Systems Using Event Structures.,2004,"Mark Bickford, Robert L. Constable, Joseph Y. Halpern, Sabina Petride, ","Joseph Halpern, Robert Constable"
Kulfi - Robust Traffic Engineering Using Semi-Oblivious Routing.,2016,"Praveen Kumar, Yang Yuan, Chris Yu, Nate Foster, Robert D. Kleinberg, Robert Soul姓, ","Nate Foster, Robert Kleinberg"
Learning diverse rankings with multi-armed bandits.,2008,"Filip Radlinski, Robert Kleinberg, Thorsten Joachims, ","Robert Kleinberg, Thorsten Joachims"
Light-weight process groups in the Isis system.,1993,"Bradford B. Glade, Kenneth P. Birman, Robert C. B. Cooper, Robbert van Renesse, ","Ken Birman, Robbert van Renesse"
Logical attestation - an authorization architecture for trustworthy computing.,2011,"Emin G神n Sirer, Willem de Bruijn, Patrick Reynolds, Alan Shieh, Kevin Walsh, Dan Williams, Fred B. Schneider, ","Emin Gun Sirer, Fred Schneider"
Maelstrom - transparent error correction for communication between data centers.,2011,"Mahesh Balakrishnan, Tudor Marian, Kenneth P. Birman, Hakim Weatherspoon, Lakshmi Ganesh, ","Hakim Weatherspoon, Ken Birman"
